{
  "generated_at": "2026-07-22T13:10:32",
  "count": 13,
  "preset_count": 5,
  "active_status_workflow": "personal",
  "workflow_count": 2,
  "field_contract": [
    {
      "field": "status",
      "patch_column": "status",
      "kind": "workflow",
      "candidate_source": "status_workflows.*.status_values",
      "write_mode": "replace",
      "description": "论文在当前 workflow 中的主状态。"
    },
    {
      "field": "reading_stage",
      "patch_column": "reading_stage",
      "kind": "workflow",
      "candidate_source": "status_workflows.*.reading_stage_values",
      "write_mode": "replace",
      "description": "阅读深度或实现核对阶段。"
    },
    {
      "field": "review_stage",
      "patch_column": "review_stage",
      "kind": "workflow",
      "candidate_source": "status_workflows.*.review_stage_values",
      "write_mode": "replace",
      "description": "复习队列阶段。"
    },
    {
      "field": "next_review_days",
      "patch_column": "next_review",
      "kind": "schedule",
      "candidate_source": "relative days from today",
      "write_mode": "replace",
      "description": "生成 CSV patch 时转换为下次复习日期。"
    },
    {
      "field": "importance",
      "patch_column": "importance",
      "kind": "score",
      "candidate_source": "1..5",
      "write_mode": "replace",
      "description": "论文优先级或重要性评分。"
    },
    {
      "field": "research_line",
      "patch_column": "research_line",
      "kind": "taxonomy",
      "candidate_source": "papers.research_line",
      "write_mode": "replace",
      "description": "研究线。"
    },
    {
      "field": "line_role",
      "patch_column": "line_role",
      "kind": "taxonomy",
      "candidate_source": "role_order",
      "write_mode": "replace",
      "description": "论文在研究线中的角色。"
    },
    {
      "field": "domains",
      "patch_column": "domains",
      "kind": "taxonomy_list",
      "candidate_source": "papers.domains",
      "write_mode": "replace|append|remove",
      "description": "领域标签列表。"
    },
    {
      "field": "tracks",
      "patch_column": "tracks",
      "kind": "taxonomy_list",
      "candidate_source": "papers.tracks",
      "write_mode": "replace|append|remove",
      "description": "技术路线标签列表。"
    },
    {
      "field": "problems",
      "patch_column": "problems",
      "kind": "taxonomy_list",
      "candidate_source": "papers.problems",
      "write_mode": "replace|append|remove",
      "description": "问题标签列表。"
    },
    {
      "field": "topics",
      "patch_column": "topics",
      "kind": "taxonomy_list",
      "candidate_source": "papers.topics",
      "write_mode": "replace|append|remove",
      "description": "主题标签列表。"
    },
    {
      "field": "methods",
      "patch_column": "methods",
      "kind": "taxonomy_list",
      "candidate_source": "papers.methods",
      "write_mode": "replace|append|remove",
      "description": "方法标签列表。"
    },
    {
      "field": "list_mode",
      "patch_column": "_list_mode",
      "kind": "patch_control",
      "candidate_source": "replace|append|remove",
      "write_mode": "control",
      "description": "列表字段批量写入模式。"
    }
  ],
  "field_candidates": {
    "status": [
      "unread",
      "skimmed",
      "reading",
      "read",
      "archived"
    ],
    "reading_stage": [
      "skim",
      "normal_read",
      "deep_read",
      "code_checked"
    ],
    "review_stage": [
      "fresh",
      "due",
      "reviewed"
    ],
    "importance": [
      "1",
      "2",
      "3",
      "4",
      "5"
    ],
    "line_role": [
      "foundation",
      "baseline",
      "main",
      "system",
      "variant",
      "followup",
      "survey"
    ],
    "list_mode": [
      "replace",
      "append",
      "remove"
    ],
    "research_line": [
      "Parallel Decoding with Diffusion Models",
      "LLM Serving",
      "Efficient Attention Kernels",
      "VLM Acceleration",
      "Speculative Decoding"
    ],
    "domains": [
      "LLM Systems",
      "Multimodal Systems"
    ],
    "tracks": [
      "Inference Acceleration",
      "Parallel Decoding",
      "Attention Kernels",
      "VLM Acceleration",
      "Inference Serving Systems"
    ],
    "problems": [
      "Lossless Speculative Decoding",
      "Efficient VLM Inference",
      "Long-Response Decoding",
      "Visual Token Redundancy",
      "Parallel Diffusion Decoding",
      "Memory-Efficient Parallel Token Generation",
      "MoE Serving",
      "Load-Aware Serving",
      "Customizable Attention Serving",
      "Speculative Decoding",
      "Efficient Exact Attention"
    ],
    "topics": [
      "Speculative Decoding",
      "LLM Inference",
      "LLM Serving",
      "Diffusion Language Models",
      "LLM",
      "Parallel Decoding",
      "KV Cache",
      "Multimodal Inference",
      "Vision-Language Models",
      "Visual Token Pruning",
      "VLM Acceleration",
      "Distributed Inference",
      "Systems Optimization",
      "Disaggregated Serving",
      "Load Balancing",
      "MoE",
      "Semi-Autoregressive Generation",
      "Attention Kernels",
      "GPU Systems",
      "Inference Optimization",
      "Draft Model Training",
      "Scaling Law",
      "Efficient Inference",
      "Multi-Token Prediction",
      "Non-Autoregressive Generation",
      "Compiler/DSL",
      "Hardware Acceleration",
      "Kernel Generation",
      "LLM Code Generation",
      "Multi-Agent Systems"
    ],
    "methods": [
      "Speculative Decoding",
      "gated LoRA",
      "FlashAttention",
      "distillation",
      "FinalWipe",
      "multi-head twig",
      "pruning-oriented reinforcement learning",
      "tree-based self-speculative decoding",
      "twig-guided token pruning",
      "block diffusion",
      "KV injection",
      "parallel drafting",
      "target hidden features",
      "asynchronous decoding",
      "cache-aware sampling",
      "fallback speculation",
      "geometric fan-out",
      "verification outcome cache",
      "introspective consistency",
      "introspective strided decoding",
      "logit-shifted causal training",
      "p/q acceptance",
      "SGLang serving",
      "dual-view attention",
      "forward KL distillation",
      "intra-model consensus",
      "masked diffusion",
      "shared KV cache",
      "Balanced K-means",
      "Expert Locality Routing"
    ]
  },
  "presets": [
    {
      "id": "triage",
      "label": "标记待分流",
      "description": "把一批论文推进到初筛/分流队列，并安排一周内复看。",
      "fields": {
        "status": [
          "triaged",
          "unread"
        ],
        "reading_stage": [
          "skimmed",
          "skim"
        ],
        "review_stage": [
          "fresh"
        ],
        "next_review_days": 7
      },
      "field_count": 4,
      "patch_columns": [
        "slug",
        "status",
        "reading_stage",
        "review_stage",
        "next_review"
      ],
      "compatible_workflows": [
        "personal",
        "research"
      ],
      "workflow_compatibility": [
        {
          "workflow": "personal",
          "compatible": true,
          "resolved_fields": {
            "status": "unread",
            "reading_stage": "skim",
            "review_stage": "fresh"
          },
          "missing_fields": []
        },
        {
          "workflow": "research",
          "compatible": true,
          "resolved_fields": {
            "status": "triaged",
            "reading_stage": "skim",
            "review_stage": "fresh"
          },
          "missing_fields": []
        }
      ],
      "library_href": "library.html"
    },
    {
      "id": "deep_read",
      "label": "进入深读",
      "description": "把筛选出的核心论文推进到深读队列。",
      "fields": {
        "status": [
          "reading",
          "triaged"
        ],
        "reading_stage": [
          "deep_read"
        ],
        "review_stage": [
          "fresh"
        ],
        "next_review_days": 14
      },
      "field_count": 4,
      "patch_columns": [
        "slug",
        "status",
        "reading_stage",
        "review_stage",
        "next_review"
      ],
      "compatible_workflows": [
        "personal",
        "research"
      ],
      "workflow_compatibility": [
        {
          "workflow": "personal",
          "compatible": true,
          "resolved_fields": {
            "status": "reading",
            "reading_stage": "deep_read",
            "review_stage": "fresh"
          },
          "missing_fields": []
        },
        {
          "workflow": "research",
          "compatible": true,
          "resolved_fields": {
            "status": "reading",
            "reading_stage": "deep_read",
            "review_stage": "fresh"
          },
          "missing_fields": []
        }
      ],
      "library_href": "library.html"
    },
    {
      "id": "code_check",
      "label": "补代码检查",
      "description": "把论文推进到代码检查/实现核对队列。",
      "fields": {
        "status": [
          "reading",
          "read"
        ],
        "reading_stage": [
          "code_checked",
          "deep_read"
        ],
        "review_stage": [
          "reviewed",
          "fresh"
        ],
        "next_review_days": 30
      },
      "field_count": 4,
      "patch_columns": [
        "slug",
        "status",
        "reading_stage",
        "review_stage",
        "next_review"
      ],
      "compatible_workflows": [
        "personal",
        "research"
      ],
      "workflow_compatibility": [
        {
          "workflow": "personal",
          "compatible": true,
          "resolved_fields": {
            "status": "reading",
            "reading_stage": "code_checked",
            "review_stage": "reviewed"
          },
          "missing_fields": []
        },
        {
          "workflow": "research",
          "compatible": true,
          "resolved_fields": {
            "status": "reading",
            "reading_stage": "code_checked",
            "review_stage": "reviewed"
          },
          "missing_fields": []
        }
      ],